{
  "$schema": "http://json-schema.org/draft-07/schema#",
  "$id": "https://tradeops.local/schemas/events/orders/order.created.v1.json",
  "title": "order.created v1",
  "type": "object",
  "additionalProperties": true,
  "required": ["orderId", "userId", "symbol", "side", "quantity"],
  "properties": {
    "eventType": { "type": "string", "enum": ["order.created"] },
    "eventVersion": { "type": "string" },
    "eventId": { "type": "string" },
    "tenantId": { "type": "string" },
    "correlationId": { "type": "string" },
    "traceparent": { "type": "string" },
    "occurredAt": { "type": "string", "format": "date-time" },
    "source": { "type": "string" },
    "orderId": { "type": "string" },
    "userId": { "type": "string" },
    "symbol": { "type": "string" },
    "side": { "type": "string" },
    "orderType": { "type": "string" },
    "quantity": { "type": "number" },
    "limitPrice": { "type": ["number", "null"] },
    "status": { "type": "string" }
  }
}
