{
  "eventId": "11111111-1111-4111-8111-111111111111",
  "eventType": "order.created",
  "orderId": "22222222-2222-4222-8222-222222222222",
  "userId": "33333333-3333-4333-8333-333333333333",
  "symbol": "AAPL",
  "side": "BUY",
  "orderType": "LIMIT",
  "quantity": 1000,
  "limitPrice": 150,
  "status": "created",
  "occurredAt": "2026-06-08T10:00:00Z",
  "correlationId": "demo-surveillance-large-order"
}
