{
  "eventId": "audit-demo-order-created-001",
  "eventType": "order.created",
  "tenantId": "default-tenant",
  "orderId": "11111111-1111-4111-8111-111111111111",
  "userId": "33333333-3333-4333-8333-333333333333",
  "symbol": "AAPL",
  "side": "BUY",
  "quantity": 100,
  "correlationId": "demo-correlation-123",
  "occurredAt": "2026-06-08T10:00:00Z"
}
